videoWebUrl,comment_count,avg_comment_sentiment,top_positive_sentiment,top_positive_text,top_positive_time,top_negative_sentiment,top_negative_text,top_negative_time,neutral_sentiment,neutral_text,neutral_time
https://www.tiktok.com/@miss_mars_97/video/7453247607779953953,25,0.125488,0.8834,"what if aliens are super super small like cells and they already visited the earth, and we evolve from them and technically we are the aliens",2025-11-08T09:43:42.000Z,-0.6497,guys they aren’t trying to say the sea angel is scary they’re just showing how even on our own planet the creatures dont look anything like a human,2025-07-25T09:38:41.000Z,0.0,I just realized that we all just assume aliens are in space... what if they're living alongside us and we don't notice hem because they look identical to us or are invisible,2025-04-16T22:34:03.000Z
https://www.tiktok.com/@alienimpact/video/7566730784061672726,25,0.121572,0.9766,Greetings humans✌✌✌We are all ready here✌✌✌💞,2025-10-29T21:15:45.000Z,-0.7269,"You can’t travel to a different planet and function with different gravity, atmospheric pressure and the mix of inhaled gases. Any being would die instantly.",2025-11-02T21:17:48.000Z,0.0,why is it blurred ( as usual ) ?,2025-10-29T22:42:09.000Z
https://www.tiktok.com/@dylan.page/video/7067847296091704582,25,0.121112,0.9716,🥰🥰🥰,2024-12-13T14:04:14.000Z,-0.765,"Covid, war and now ufos damn bro what’s next 💀",2022-02-25T11:26:15.000Z,0.0,Guys it’s just a fortnite crossover chill,2022-02-23T10:26:46.000Z
https://www.tiktok.com/@ufonomenon/video/7559542618699484438,24,0.1192559999999999,0.9877,😄😄😄😄😄😄es ia 😄,2025-10-10T11:54:46.000Z,-0.4927,I’m so tired of ai,2025-10-30T11:17:41.000Z,0.0,ai,2025-10-10T15:53:59.000Z
https://www.tiktok.com/@the_life_of_haley/video/7260579078951013674,25,0.113728,0.93,I'm laughing too😂😂😂😂,2025-05-16T20:52:05.000Z,-0.4767,what is wrong with you bro 💀,2023-08-02T08:56:48.000Z,0.0,I need some of whatever she's on 💀,2025-01-08T13:22:26.000Z
https://www.tiktok.com/@tannerz64/video/7217507598717717806,25,0.113328,0.969,💖💖💖😍,2024-11-26T06:19:58.000Z,-0.628,"IF YOU REALLY LOOK , IT LOOKS SUSPENDED FROM WIRES , NOTICE THE ROCKING OF THE LIGHT FORMATION !",2023-11-23T09:29:01.000Z,0.0,"Its starlink, a new thing elon musk did with spacex and they go in a line at 500 per hour",2023-08-01T08:38:50.000Z
https://www.tiktok.com/@princessthickforeigner/video/7537891027504581901,16,0.112304,0.9591,We never serious 😂😂😂😂😂 we joke about everything 🤣,2025-08-15T07:22:09.000Z,-0.7757,"What makes you think they were ""arrogant""? How does a person ""looks"" arrogant?",2025-08-17T15:49:46.000Z,0.0,Yall the Dutch told us abt this a long time ago. look up 1992 space movie,2025-08-14T18:22:47.000Z
https://www.tiktok.com/@thenevadatriangle/video/7569373449416756494,17,0.1117470588235294,0.9274,♥️♥️♥️,2025-11-08T00:51:06.000Z,-0.3291,Don’t know if anyone will believe me but I saw one of these for a few seconds in the sky it was the most ethereal looking being and was so white it was so pure looking and it sprawled out its wings then disappeared when I directly stared at it,2025-11-14T22:46:40.000Z,0.0,hologram,2025-11-07T16:45:24.000Z
https://www.tiktok.com/@ufotopia/video/7442788402732338465,25,0.108656,0.7906,I would love this to be true,2024-11-30T17:32:02.000Z,-0.7003,本当だったらすごい😱,2024-12-05T14:23:22.000Z,0.0,AI at Stonehenge u mean,2024-12-04T13:41:12.000Z
https://www.tiktok.com/@ufonomenon/video/7514993782069267734,25,0.107332,0.8885,χαχαχαχαααααααααααα😅😅😅😅😅,2025-06-14T11:07:09.000Z,-0.296,es un modelo de los antiguos y además la ITv no la tiene al día,2025-06-16T14:39:30.000Z,0.0,It’s going to happen folks,2025-06-15T13:49:33.000Z
https://www.tiktok.com/@ficheiroproibido/video/7570742391087435028,20,0.10704,0.7269,esa bacteria microscopica es interesante 🤣😂,2025-11-10T19:00:52.000Z,-0.296,"Que nasa?
Si esa cosa existiera la nasa nunca lo haria saber a todo el mundo si no a los altos rangos de su país",2025-11-12T05:12:45.000Z,0.0,bactéria vista pelo microscópio,2025-11-10T00:29:08.000Z
https://www.tiktok.com/@the_twilight_emporium/video/7246060234798550318,25,0.1064599999999999,0.836,lolz owl tree stump has clearly never been in a vegas back yard. there is waaaay too much greenery in that video 😆,2023-06-18T18:18:36.000Z,-0.8519,somebody go get their grampa 😭😭😭,2023-06-26T02:22:05.000Z,0.0,Can you debunk Roswell ufo incident?,2023-07-09T10:08:38.000Z
https://www.tiktok.com/@ufonomenon/video/7565135299785854230,24,0.106236,0.926,AI 😂😂😂😂😂,2025-10-29T11:50:17.000Z,-0.296,es IA no es Verdad.,2025-11-05T00:43:46.000Z,0.0,it looks real as there's shadow and besides that it can reflect the water waves beneath it.,2025-10-26T09:25:20.000Z
https://www.tiktok.com/@puredoller/video/7523322869825178935,25,0.10532,0.9716,Pleiadian Crafts 🥰🥰🥰,2025-07-07T07:30:38.000Z,-0.3612,Did the battery get drained while you were recording?,2025-07-04T23:49:04.000Z,0.0,this is real y'all not AI,2025-07-05T07:09:20.000Z
https://www.tiktok.com/@timthetech85/video/7407378945391250731,25,0.103144,0.9432,Och people.... You are so.......🤣🤣🤣🤣🤣,2025-10-23T20:31:57.000Z,-0.8442,it reminds me of the movie Hell Raiser. the female hell raiser chic,2025-11-18T05:34:18.000Z,0.0,your bear video looks more real,2025-10-14T03:45:47.000Z
https://www.tiktok.com/@cienciavideos/video/7556064060739947798,25,0.101372,0.9052,What is coming will come and pass but Our God of HOST will naver pass away. we will all see 2026 in peace and safe too 🙏🏿 ❤️type Amen if u believ.,2025-10-04T07:52:19.000Z,-0.8519,they are my Brothers from Kasoa😭😭😭,2025-10-02T20:35:07.000Z,0.0,Ohps!My Freinds Aliens Are Here Now On Earth.Amazing You Have Come Down On Earth.,2025-10-24T06:04:06.000Z
https://www.tiktok.com/@ufogod_/video/7569326406954437919,24,0.10004,0.891,Only in America 😂😂😂😂,2025-11-06T04:58:17.000Z,-0.5719,I hate ai,2025-11-18T03:00:50.000Z,0.0,this is real?,2025-11-06T00:14:56.000Z
https://www.tiktok.com/@itsweirdtime/video/7348967042223017258,25,0.099012,0.8217,I think it’s the military. they are so advanced with stuff that we don’t even know about.!! it’s amazing!!!!,2025-08-09T18:58:25.000Z,-0.8519,That thing flew so fast out of the water😭😭😭,2025-03-21T16:51:41.000Z,0.0,They were spot lighting a vessel floating out on the water... that's not a UFO,2025-11-11T16:36:07.000Z
https://www.tiktok.com/@staygroundead/video/7210576126253583658,25,0.094376,0.9265,Best commentary 👌 🤣,2025-11-16T14:40:11.000Z,-0.8519,“i don’t even know what a meteor is” 😭😭😭,2023-03-23T19:13:14.000Z,0.0,“ That’s another dimension right theaa ” 💀💀💀,2023-03-20T03:58:26.000Z
https://www.tiktok.com/@ufo_vnestrima/video/7565082254364511510,21,0.09426,0.9169,Bro the world is a simulation cuz why is our reality mimicking 5th Element. That’s the Fhloston Paradise space cruiser 😂😂😂,2025-10-25T15:23:27.000Z,-0.5423,isnt that thing supposed to be hauling ass?,2025-10-26T03:23:48.000Z,0.0,This is a microscopic image of something that lives within water,2025-10-25T15:34:18.000Z
https://www.tiktok.com/@unknown.ufo.world.ai/video/7456657218369244458,25,0.0906039999999999,0.926,gagal tah nyieun film teh teu daek ngapung😂😂😂😂😂,2025-01-11T05:41:54.000Z,-0.636,"E-UFO... wenn die Klimaanlage zulange an ist, fliegt das Ding nicht mehr!",2025-01-08T19:42:07.000Z,0.0,Motorlampe leuchtet,2025-03-03T05:42:00.000Z
https://www.tiktok.com/@incognitogamingtv/video/7498651649649446174,25,0.088492,0.6705,if there's something like that flying around I don't know why we still follow the law😎,2025-04-29T15:51:27.000Z,-0.4767,😭 I can't tell what's real anymore,2025-04-30T03:45:30.000Z,0.0,This is Al !!!,2025-04-29T16:49:38.000Z
https://www.tiktok.com/@entertainment.t.v1/video/7570373466289949983,24,0.084736,0.9578,Looks like a skin walker lol💚💚💚,2025-11-08T19:39:08.000Z,-0.8227,"Reason, 597 nothing good comes at night. Poor dogs are like I don’t know what the hell that is.",2025-11-15T22:18:44.000Z,0.0,I would fall over and pass if I saw this. Yikes!!!!!,2025-11-16T15:16:10.000Z
https://www.tiktok.com/@reza.lashes/video/7570216365903203598,18,0.084732,0.8481,"Sounds like a natural gas relief valve, do you have a gas well in tge valley?",2025-11-08T13:24:31.000Z,-0.4939,50 calls of wasted dispatchers time,2025-11-08T16:56:04.000Z,0.0,Mecha Godzilla coming we are cooked,2025-11-09T11:41:57.000Z
https://www.tiktok.com/@maxrebojr/video/7154887177883749678,25,0.0846119999999999,0.958,enserio es una cometa en forma de medusa aquí en República Dominicana eso es muy normal 🙆🏽‍♂️🤣🤣🤣🤣🤣,2025-06-10T16:58:38.000Z,-0.7003,guerra de dos mundos 😱,2025-06-08T12:40:23.000Z,0.0,es un cometa en forma de medusa 🤷,2025-06-07T22:01:09.000Z
https://www.tiktok.com/@pejesaurio69/video/7514680625454927146,25,0.083428,0.7003,it’s all the people learning how to astro project 😂😂,2025-06-16T00:08:17.000Z,-0.4023,And that's why we don't trust ai,2025-06-27T14:02:42.000Z,0.0,Blue beam,2025-06-14T03:13:32.000Z
https://www.tiktok.com/@arounthecorner_/video/7563112753339059486,21,0.0828879999999999,0.8271,AI😂😂😂👍,2025-10-25T01:45:57.000Z,-0.3612,they just took the word gullible out the dictionary,2025-10-21T15:41:22.000Z,0.0,Filmed with the brand new iPhone 17 Pro Max,2025-10-21T09:47:55.000Z
https://www.tiktok.com/@dailyufovideos/video/7485534441729740054,25,0.081564,0.686,where's the full footage? what happened with it? did it fly away? could u or did u follow it? did it just disappear? what? what happened with it? please! 😁,2025-03-31T21:51:00.000Z,-0.4019,that's a damn dementor. rare to see them in the light.,2025-03-31T07:01:57.000Z,0.0,Hahah!! UFOs only show in the USA … I guess they know we use ticktock,2025-03-25T20:18:37.000Z
https://www.tiktok.com/@fernandoivanoffgomes/video/7532840057502305558,23,0.081112,0.7184,Nämä ufot valmistetaan Joensuussa 😊,2025-07-30T14:09:15.000Z,-0.4767,Ufo 😭,2025-07-30T12:49:13.000Z,0.0,Imagine living in 2025 and has never heard of a zeppelin.,2025-08-01T11:24:28.000Z
https://www.tiktok.com/@abejareyina/video/7132646943066705198,24,0.0809559999999999,0.969,IT'S BURNED YO 😂😂😂😂😂😂😂😂,2022-08-17T04:52:09.000Z,-0.3597,I would be more worried about why there isn't a sun in the sky.,2025-02-08T23:43:15.000Z,0.0,reminds me of the movie “Nope”,2022-08-17T04:07:32.000Z
https://www.tiktok.com/@sybervisions_/video/7463453794286800135,25,0.080336,0.9413,😂😂se nota cuando hacen mal las cosas 😂😂😂😂👋🏻👆🏻,2025-09-08T04:37:44.000Z,-0.4767,The dude from Pixels 😭,2025-06-30T19:04:24.000Z,0.0,Ai jing,2025-10-10T22:19:11.000Z
https://www.tiktok.com/@the_darkentity/video/7526978115487272222,24,0.078268,0.5719,The answer to the question: “Do aliens celebrate Christmas too?”,2025-07-17T21:14:52.000Z,-0.5267,One day one of these are gonna be real and were all not gonna believe it because people are always lying so much about it,2025-07-17T06:08:48.000Z,0.0,we're so cooked man people will believe anything 🙄,2025-07-17T04:42:50.000Z
https://www.tiktok.com/@ufonomenon/video/7485448002564377878,25,0.076444,0.644,"Ndio mnasema,hivi vidude kabla hujafanya jambo chenyewe kimeshafahamu?😂sasa mbona hakijaamka kabla😂😂?",2025-03-25T11:09:52.000Z,-0.296,Dios quiera que ésto no esté pasando,2025-03-24T21:17:58.000Z,0.0,AI,2025-10-25T11:02:02.000Z
https://www.tiktok.com/@caspersight/video/7571152307824463127,25,0.075828,0.891,😂😂😂😂 travel's millions of light year's to stalk someone in a house 🏠 and bars stop them. ok,2025-11-11T17:37:01.000Z,-0.9061,"one night i had a similar experience, woke up in the middle of the night. a grey figure was walking into the bedroom in the dark, I was terrified, it looked very disturbing and moved in a stranger and sinister way. than I realised it was rhe ex-wife without her make up on.",2025-11-11T20:30:22.000Z,0.0,"What you see in this video,is US humans in the future, a cosmic event will make some humans evolve and some will die,so what you see is us from the future,not aliens from space,space means what you see around us...not what they told you.",2025-11-11T15:15:22.000Z
https://www.tiktok.com/@xashleyyniicole/video/7557877609833549111,15,0.0757399999999999,0.6369,❤,2025-10-23T01:16:43.000Z,-0.7351,🔥🔥🔥,2025-11-04T03:42:26.000Z,0.0,This is the real video but there was another where the portal showed,2025-10-16T10:51:30.000Z
https://www.tiktok.com/@voidtapes_x/video/7558064314196708630,18,0.072408,0.8271,😂😂😂,2025-10-08T21:13:53.000Z,-0.5574,Sigo sin creer en esto,2025-10-06T16:13:19.000Z,0.0,"real or cake 2020
real or ai 2025",2025-10-07T17:07:04.000Z
https://www.tiktok.com/@jesterlloyd/video/7403216191415749931,25,0.0717,0.836,Why is he shivering like that ? 🤣🤣,2024-12-01T06:36:40.000Z,-0.8402,It’s 2025 and it’s coming agian😢😢😓,2025-11-02T09:12:22.000Z,0.0,I’ve seen that exact thing and it kept disappearing and reappearing at,2025-09-29T23:13:55.000Z
https://www.tiktok.com/@vii_viig/video/7163103948478467370,23,0.070572,0.8625,that's the slowest UFO ever recorded so far🤣🤣🤣,2025-10-27T13:35:49.000Z,-0.6808,hell,2025-09-20T02:08:17.000Z,0.0,there's a jumpscare,2025-11-08T03:58:16.000Z
https://www.tiktok.com/@creepytales100/video/7467557675950361902,25,0.068996,0.926,parece una bola de discoteca de los 80 😂😂😂😂😂,2025-02-17T18:58:51.000Z,-0.4019,This is actually insane,2025-02-19T23:31:58.000Z,0.0,It’s the Italian UFO,2025-03-21T21:21:01.000Z
https://www.tiktok.com/@jennlynn323/video/7569288347953155359,25,0.068656,0.6963,well I googled if there were any rocket launches in that area in the last few days or so and there wasn't any. so GOD knows what's that. 🙏🏼,2025-11-06T05:44:09.000Z,-0.7922,They will tell you rocket launch but Im not that easily fooled. The lack of disclosure is maddening.,2025-11-07T02:53:26.000Z,0.0,Why isn't anyone saying portal?,2025-11-05T20:56:51.000Z
https://www.tiktok.com/@classictunedpro/video/7527186847856938253,25,0.062824,0.658,"This is amazing! I don't even have words, absolutely mind blowing! it is FLAMING",2025-07-16T15:30:42.000Z,-0.6499,that ain't no kite at all you saw what you saw 🔥🔥🔥,2025-07-16T01:38:11.000Z,0.0,100% It's a Kyubi,2025-07-17T03:17:09.000Z
https://www.tiktok.com/@virtmedia.films/video/7537846737340222775,25,0.062532,0.9968,"Mughal emperor
😅😅😅😅😅😅😅😅😅😅😅😅😅😅😅😅😅😅😅😅😅😅😅😅😅😅😅😅😅😅😅😅",2025-10-11T11:58:05.000Z,-0.5267,Ellos no son malos no se asusten.,2025-08-20T19:41:12.000Z,0.0,Is it real?,2025-08-22T12:24:40.000Z
https://www.tiktok.com/@izzat_5.01/video/7481461891672395054,25,0.061972,0.8591,Now great great grandpa I told u about cave diving,2025-03-16T02:49:35.000Z,-0.4939,Scary✖️cute✔,2025-10-20T12:18:54.000Z,0.0,Awawa,2025-10-20T01:40:41.000Z
https://www.tiktok.com/@alienslastnight/video/7569409346069744909,24,0.061952,0.5994,Test rockets maybe? They saw spiraling like that in Norway and it was determined to be test rockets,2025-11-06T07:46:03.000Z,-0.296,no zoom i guess,2025-11-09T16:59:07.000Z,0.0,This is my video!,2025-11-06T11:01:29.000Z
https://www.tiktok.com/@incognitogamingtv/video/7512382150780439838,25,0.06162,0.9106,хороший кинотеатр 👌🤣🤣,2025-06-06T12:45:44.000Z,-0.296,tuve esos sueños y se q son reales solo q no los vemos,2025-07-31T17:33:20.000Z,0.0,Its real that blue beam project,2025-06-07T21:12:18.000Z
https://www.tiktok.com/@miss_lisa_lopez/video/7522295940334619959,25,0.059108,0.8225,😂😅🤣 its smoke signals....,2025-07-03T23:45:48.000Z,-0.8225,"Guys when Jesus comes back, there will be stars falling out the sky, fire raining down on the world , the moon turning and staying red , eclipses that last days not minutes plus we still waiting the the 3rd temple the 12 tribes to come back to Israel and the Antichrist plus 10 years of hell before Jesus comes back",2025-07-05T02:24:21.000Z,0.0,So aliens are real,2025-07-04T17:25:30.000Z
https://www.tiktok.com/@slopguap/video/7562071929516068127,25,0.05728,0.7506,He just wanted a kitten 🤣🤣,2025-10-18T14:41:22.000Z,-0.4767,Fake sheet,2025-10-30T19:47:12.000Z,0.0,He needed a new catalytic converter,2025-11-15T14:51:22.000Z
https://www.tiktok.com/@magicmetamorph/video/7497250367307091222,25,0.05676,0.9118,😂😂😂😂😂😂CBC -Reporting live........,2025-04-27T20:35:11.000Z,-0.5267,wth,2025-04-29T17:23:48.000Z,0.0,If anyone thinks this is real.. your car extended warranty is about to expire…,2025-04-27T21:57:05.000Z
https://www.tiktok.com/@nicoleadams19800/video/7440754189199854894,25,0.050768,0.8201,I met a dude who’s eyes changed into black lines but nobody believes me he looked like my friend he was a doppelgänger,2024-11-25T06:19:30.000Z,-0.7845,"yall keep saying higher dimensions, if theyre evil n hurt us theyre lower dimension than us, lower beings.. u can fight them but not physically, spiritually",2024-11-24T19:05:47.000Z,0.0,Miami aliens was a hologram,2024-11-26T14:32:13.000Z
https://www.tiktok.com/@ufonomenon/video/7506133036153556246,24,0.049664,0.9432,"красивый снимок,один вопрос кто придумал так нарисовать инопланетян больше чем сама тарелка🤣🤣🤣🤣🤣",2025-06-19T19:25:13.000Z,-0.7003,This is a creature I've never seen before.😱,2025-08-28T02:45:53.000Z,0.0,Ai,2025-10-07T15:02:45.000Z
https://www.tiktok.com/@sagereon/video/7540244355328560391,20,0.043076,0.8074,I meet them yesterday🥰,2025-10-11T01:50:12.000Z,-0.4215,"I saw one, not aliens, but a saucer, but no one believes me",2025-09-20T14:19:54.000Z,0.0,But they don’t wanna meet me,2025-09-30T18:08:56.000Z
https://www.tiktok.com/@user88323447652263/video/7558455223044394295,20,0.042544,0.7579,Bro I literally follow this guy not the guy telling the story but the guy with the creature look on my TikTok frns and you'll see that I'm following him. 😏😅😅,2025-11-17T05:17:31.000Z,-0.802,Did not know we are mixing the upside down with the real fucking world my g I want a bmw x3m competition b4 I die man I don’t want to die to thiabshit,2025-10-09T14:09:28.000Z,0.0,Is this real?! or AI? It looks so real,2025-10-28T00:08:19.000Z
https://www.tiktok.com/@dailyufovideos/video/7535866963403427094,22,0.0415879999999999,0.7297,that's wild 👌,2025-09-03T11:51:49.000Z,-0.7701,está en camara lenta y aún así es rápido esa cosa!!! 😳😱,2025-08-22T05:29:39.000Z,0.0,My concern is the potential for the dog to fall down the hill.,2025-08-10T20:00:13.000Z
https://www.tiktok.com/@camryn__venom/video/7569026962841242910,23,0.041256,0.5423,my aunt recorded this too from bergen county Nj. when she tried sending me the video it was super blurry,2025-11-05T11:14:57.000Z,-0.6369,we are all doomed,2025-11-08T14:41:29.000Z,0.0,This is the aftermath of a rocket launch.,2025-11-07T22:07:41.000Z
https://www.tiktok.com/@cienciavideos/video/7559417379080523030,21,0.041228,0.7003,Akoa yi s3 ALATA samina 😂😂,2025-10-11T21:03:51.000Z,-0.7003,ほんとうなら怖い😱,2025-10-13T07:11:47.000Z,0.0,is this real,2025-10-10T10:59:10.000Z
https://www.tiktok.com/@zoomnboom/video/7506194199730048287,25,0.038568,0.6808,"😭😂😂😂 tell me you've never been around fish, with out telling me you've never been around fish",2025-06-09T06:05:49.000Z,-0.34,A school of fish in the ocean 😱🙄 if we’re shiny or actually shaped like 🛸 then I’d think 👽 either way cars made video worth it tho,2025-05-21T08:52:40.000Z,0.0,It’s a school of fish. It’s not a fucking alien.,2025-05-20T00:02:34.000Z
https://www.tiktok.com/@pennypincher1234/video/7537341578466037023,23,0.038436,0.9928,Ashkenazi Jews 😔😔😔😔. They are 🤣🤣🤣🤣🤣🤣🤣🤣🤣🤣🤣🤣🤣🤣🥲🤣,2025-11-05T19:03:56.000Z,-0.8519,empire?😭😭😭,2025-08-13T04:46:30.000Z,0.0,TR-3B Black Manta,2025-08-13T17:19:34.000Z
https://www.tiktok.com/@disishiphoptv/video/7515269414175001886,22,0.038124,0.8625,“Yall the aliens cominggggg”🤣🤣🤣,2025-06-18T23:02:44.000Z,-0.5859,it's a UFO foe real y'all 😂......it's not a UFO that's the Walmart parking lot light,2025-06-29T12:02:09.000Z,0.0,So nobody gonna talk about the black hole,2025-09-24T22:39:04.000Z
https://www.tiktok.com/@holoskypodcast/video/7374196903895944494,24,0.037796,0.8092,This is Amazing if it's real! I'm so ready for them for them,2024-05-29T17:59:04.000Z,-0.4767,so when we trip over nothing is it an alien foot. 😭,2024-11-14T15:08:45.000Z,0.0,Am I the only one that doesn’t see anything?,2024-09-04T06:35:41.000Z
https://www.tiktok.com/@curious_sam_/video/7321096960763743534,25,0.037288,0.875,😂😂😂 big fan of Messi,2024-01-10T07:13:24.000Z,-0.7533,?A big shadow?..🤔😲😬😬😬😬😬.......... My EX!!!..........🤣💀💀,2024-01-20T05:39:28.000Z,0.0,there was nothing?,2024-01-10T11:59:30.000Z
https://www.tiktok.com/@samat_l6/video/7538035454591978808,24,0.036288,0.6739,me encontré otro vídeo del mismo ovni abajo de este video XD,2025-08-13T17:04:11.000Z,-0.5267,Me preocupa que ya vi como 10 perspectivas diferentes y no sé si es real o no 💀,2025-08-13T16:26:16.000Z,0.0,Es una Nave de Estados Unidos se llama TR-3B,2025-08-13T17:20:45.000Z
https://www.tiktok.com/@darkmysteries8/video/7541844334967000342,21,0.03544,0.875,You sure it’s a laser line 😂😂😂,2025-08-24T10:22:08.000Z,-0.6705,Bro make a big mistake 😭,2025-08-25T09:58:09.000Z,0.0,[sticker],2025-10-18T18:07:39.000Z
https://www.tiktok.com/@myst3ryf0und/video/6979709237496745222,25,0.0343959999999999,0.5598,stranger things it was so true,2021-07-06T12:23:06.000Z,-0.5994,Have you seen Tomorrow War? 😳,2021-07-30T20:37:47.000Z,0.0,The ninja turtles￼,2021-07-08T18:35:59.000Z
https://www.tiktok.com/@crazyclips1582/video/7570440061750234399,19,0.03156,0.9537,"Wow, Wow! whatever it is, its Beautiful!❤",2025-11-09T21:15:01.000Z,-0.9081,ai is to real 😭😭😭😭,2025-11-14T01:29:59.000Z,0.0,CGI HOLOGRAMS PROJECT BLUE BEAM .,2025-11-10T13:46:11.000Z
https://www.tiktok.com/@twistedterrors_1/video/7542384288528977174,24,0.0299239999999999,0.9631,BRO THE GORG FOUND US!!!!🤣🤣🤣🤣✨✨✨,2025-11-21T19:45:12.000Z,-0.7184,Oh hell nah palpatine is coming,2025-11-21T12:51:43.000Z,0.0,what is ufo,2025-09-24T19:26:28.000Z
https://www.tiktok.com/@laclippa323/video/7531126169454890270,24,0.0288279999999999,0.8225,😂 how do we know how about alien looks like 🤭,2025-07-27T15:33:08.000Z,-0.8519,"I had the same thing happened to me and I saw it with my own eyes, but I was scared to tell anyone about it because they might say I’m a weirdo or I’m crazy and every Thursday night look just right of Northstar, you will see a unusual light move left to right and it had straight down to earth and I mean not slow I mean supersonic speed if you don’t believe me, go and look this Thursday",2025-08-03T23:50:53.000Z,0.0,a person in black clothes with 2 plastic bags full of groceries.,2025-07-29T01:53:02.000Z
https://www.tiktok.com/@anthonysanchez405/video/7404269140711623967,25,0.0284359999999999,0.953,Yes finally more accurate alien sightings 👏🏼👏🏼♥️♥️♥️WOOO THEY ARE OUT THERE!!!,2024-11-13T15:51:16.000Z,-0.4404,sorry if I was bothering yall,2024-10-13T04:42:53.000Z,0.0,"Someone ordered sunlight, you haven’t heard?",2024-08-24T23:20:18.000Z
https://www.tiktok.com/@actressjazzmonbaker/video/7268119534752632107,25,0.027724,0.5106,Our father in heaven,2023-08-17T22:33:00.000Z,-0.7269,They figured out how to make Teslas death ray weapon of the gods,2023-08-21T01:28:25.000Z,0.0,This was in Ft Myers in 2015-not a new picture,2023-08-21T01:54:34.000Z
https://www.tiktok.com/@lolondondior/video/7571357064082115870,24,0.0242439999999999,0.4954,Yall wanna see aliens so bad 😂😂😂,2025-11-15T08:35:32.000Z,-0.2263,They are stars that are old and they need to go so they lined up and then disappear for new starts can come in,2025-11-14T08:23:17.000Z,0.0,Nothing pmo more than seeing people believing in UFOs,2025-11-18T10:27:14.000Z
https://www.tiktok.com/@divinepisces444/video/7407535192686054687,25,0.023436,0.8795,I swear it’s getting more active. Stay safe love.,2024-08-27T00:22:04.000Z,-0.861,those screams sounds so terrifying 😭,2024-09-03T02:27:40.000Z,0.0,the frequency sounds is wild yo,2024-08-27T10:42:11.000Z
https://www.tiktok.com/@shanman9390/video/7571441254819499319,25,0.021388,0.8625,Authorities would be the LAST people i call🤣🤣🤣,2025-11-12T12:48:32.000Z,-0.8074,that guy that showed the video of a giant was threatened before he ended up dead,2025-11-12T07:41:52.000Z,0.0,ufo in woods,2025-11-12T14:19:02.000Z
https://www.tiktok.com/@larryknight_4ever/video/7201173643722820910,25,0.016296,0.5093,there's my tweezers ! 😁,2023-07-28T18:02:25.000Z,-0.6597,They killing us an ya don’t even see it,2023-04-28T16:27:31.000Z,0.0,That’s a plane dropping chem trails,2023-06-09T18:43:08.000Z
https://www.tiktok.com/@incognitogamingtv/video/7510160539884997919,25,0.013728,0.6369,No sabía que en México hablaban ese idioma 🤣🤣,2025-05-31T23:15:04.000Z,-0.5994,Die kommen auch nur nach Amerika,2025-05-31T05:06:42.000Z,0.0,ufo 2025 ultima hora,2025-06-04T00:21:22.000Z
https://www.tiktok.com/@burgerlifeworld/video/7410340919049800977,22,0.013156,0.8834,I'm single 😍🥰,2024-09-05T22:51:55.000Z,-0.9081,MAMAH TAKUTT 😭😭😭😭,2024-09-12T11:21:18.000Z,0.0,ARE U SINGLE?,2025-09-25T13:01:20.000Z
