videoWebUrl,comment_count,avg_comment_sentiment,top_positive_sentiment,top_positive_text,top_positive_time,top_negative_sentiment,top_negative_text,top_negative_time,neutral_sentiment,neutral_text,neutral_time
https://www.tiktok.com/@baymacsdad1/video/7510503852957814046,25,0.0039439999999999,0.9612,"🤣🤣🤣 so people go to concerts and all you see is a sea of mobile phones, aliens ""appear"" yet only one person films it and it just so happens to be one of the shortest video's ever made ! OK. 🤣🤣🤣",2025-07-17T13:07:03.000Z,-0.8666,AI is becoming a mess! Worse the FAKE NEWS,2025-06-01T16:00:08.000Z,0.0,It’s will smith,2025-07-15T23:38:21.000Z
https://www.tiktok.com/@polloai025/video/7507567883199827222,25,0.000496,0.8286,I love how only 1 guy is wearing a hazmat suit LOL,2025-08-13T01:48:37.000Z,-0.5563,So sick of AI,2025-08-03T13:31:53.000Z,0.0,Making a movie?,2025-08-10T18:59:36.000Z
https://www.tiktok.com/@vanessasvirtualdiary/video/7448157033607679278,25,0.000264,0.5023,"I live in CT. Obvi I’m following the recent current events in the sky, but 4 years ago I had 2 very very close up UFO encounters. Like, I saw every single solitary detail on them. It was life changing",2024-12-14T14:42:05.000Z,-0.8653,"This is getting crazy 😩😩😩 lights and electricity is starting to act really weird, and a lady posted a video of animals acting really weird. AND ALIEN voices talking thru radio.. what is happening",2024-12-14T15:40:30.000Z,0.0,Eversource about to mail them a bill,2024-12-15T22:44:14.000Z
https://www.tiktok.com/@ai.technology86/video/7571346024359349526,3,0.0,0.0,Show us real photos,2025-11-11T21:02:36.000Z,0.0,Show us real photos,2025-11-11T21:02:36.000Z,0.0,Show us real photos,2025-11-11T21:02:36.000Z
https://www.tiktok.com/@kantoni_1/video/7563869322574122248,1,0.0,0.0,ele queria comer o gato,2025-10-22T13:33:54.000Z,0.0,ele queria comer o gato,2025-10-22T13:33:54.000Z,0.0,ele queria comer o gato,2025-10-22T13:33:54.000Z
https://www.tiktok.com/@wixys_world/video/7571353580024663303,2,0.0,0.0,@LatinoLovecraftMTG,2025-11-11T12:41:19.000Z,0.0,@LatinoLovecraftMTG,2025-11-11T12:41:19.000Z,0.0,@LatinoLovecraftMTG,2025-11-11T12:41:19.000Z
https://www.tiktok.com/@bybueze/video/7538272597595786551,21,-0.00132,0.634,ive seen some stuff similar to this God Bless us all 🙏,2025-08-28T10:47:37.000Z,-0.5106,It’s a jet that broke the sound barrier,2025-08-20T20:07:58.000Z,0.0,I lived close to spacex. It’s a star link.,2025-08-16T15:10:25.000Z
https://www.tiktok.com/@trfhobby/video/7199846730014133547,25,-0.009836,0.6486,just a track car. They send them on little used tracks to help keep them clear.,2024-12-19T01:51:39.000Z,-0.5574,no one is driving the train😬,2024-08-22T17:51:54.000Z,0.0,You see that!?.. Me either..,2024-07-19T03:56:41.000Z
https://www.tiktok.com/@shogunmessiah/video/7570762552506846494,9,-0.0104777777777777,0.7608,That’s My Town a few months ago I seen something very interesting where Definitely here!!,2025-11-14T12:33:57.000Z,-0.4939,new York at some point will be under water and I think the same goes for east coast cities ....Russia is going to detonate a bomb in the ocean posidon,2025-11-13T00:46:45.000Z,0.0,the only reason everyone can se it at the same time is because earth is not round,2025-11-10T13:58:06.000Z
https://www.tiktok.com/@zisemaoyi14/video/7569587435194174734,10,-0.0206399999999999,0.5994,Too beautiful,2025-11-06T13:26:33.000Z,-0.9468,😱😱😱,2025-11-09T12:42:04.000Z,0.0,🙏,2025-11-08T01:04:41.000Z
https://www.tiktok.com/@baby_nugget_witch/video/7557795603644796191,22,-0.0213919999999999,0.891,that's a tarp 😂😂😂😂,2025-10-06T18:34:15.000Z,-0.8924,😱 have you been abducted? is that why there's no update?,2025-10-06T05:23:34.000Z,0.0,We can’t see from here!!!!,2025-10-13T04:51:52.000Z
https://www.tiktok.com/@aliensightings/video/6872618552168320262,15,-0.02278,0.5267,Awe they were just enjoying their day,2020-09-15T17:41:55.000Z,-0.9081,Who gon say it...... 🦅😭😭😭😭,2020-09-15T13:40:41.000Z,0.0,Bird,2020-09-15T13:29:53.000Z
https://www.tiktok.com/@larryknight_4ever/video/7061686011729890606,15,-0.0277639999999999,0.4926,Good one! Nearly got me,2022-07-13T12:06:29.000Z,-0.8159,AHh HELL NAH,2025-08-18T00:14:49.000Z,0.0,OMG I see water !!!!!!,2022-02-06T20:47:32.000Z
https://www.tiktok.com/@voidtapes_x/video/7556876673661111574,20,-0.028956,0.8271,lo bueno es que si se termina el mundo panamá va a ser el primero en enterarse 😂😂😂,2025-10-03T20:36:33.000Z,-0.5267,"No me quiero imaginar que esté en verdad sea real, y que se pudo evitar que llegara a ese tamaño, porque si sigue creciendo se comerá al planeta entero. 🙆‍♀️😟",2025-10-03T15:17:20.000Z,0.0,🗿,2025-10-03T06:30:01.000Z
https://www.tiktok.com/@marvel.updatess/video/7538001754647022855,23,-0.03224,0.875,They checking to make sure you have warranties on your cars and phones 😂😂😂,2025-11-20T18:08:26.000Z,-0.8555,It’s a UFO and the USA was trying to shoot a hell fire messile and it got shot in the Atlantic Ocean,2025-09-14T02:48:45.000Z,0.0,This is so obvious ai,2025-09-11T02:56:27.000Z
https://www.tiktok.com/@the_darkentity/video/7524373938315480351,24,-0.03232,0.4939,almost looks real🤣,2025-08-12T23:11:58.000Z,-0.6808,How the hell do the aliens built that,2025-08-01T22:22:54.000Z,0.0,blue beam project,2025-08-14T20:06:53.000Z
https://www.tiktok.com/@dubbpairrion/video/7570314785900809486,22,-0.03392,0.836,The only reason I can laugh is cause im ready lol,2025-11-08T22:33:20.000Z,-0.6981,There is a war going on above us!!! IFYKYK,2025-11-13T04:44:05.000Z,0.0,3I Atlas has arrived,2025-11-08T23:35:57.000Z
https://www.tiktok.com/@isonn_/video/7247015246374718766,25,-0.034196,0.7506,Why that things just happen in America 🤣🤣,2023-06-28T05:53:23.000Z,-0.5423,Nah that’s actually wild 😭💀,2023-06-28T07:26:47.000Z,0.0,That’s the submarine,2023-06-21T11:06:00.000Z
https://www.tiktok.com/@jatanas_moon_blade/video/7524239166922558750,24,-0.04156,0.4215,lol,2025-08-25T16:26:41.000Z,-0.5696,Sad!!,2025-08-17T05:03:22.000Z,0.0,just didn’t happen did it mate,2025-09-27T19:14:22.000Z
https://www.tiktok.com/@scottcwaring/video/7465392134422580485,25,-0.0428519999999999,0.7557,I have similar videos I just posted. I'm not sure what it is but it was like a purple laser shining at me. I made a tik tok just to try and figure out what's going on lol,2025-03-06T07:07:50.000Z,-0.5574,It is just a reflection of the laser from the plane also it is illegal to do this bc it blinds the pilot,2025-03-11T16:55:09.000Z,0.0,2/2 Povs unlocked,2025-09-12T00:32:33.000Z
https://www.tiktok.com/@dtjokmv.zeawi/video/7571436325421829389,4,-0.046375,0.4939,🤣,2025-11-13T07:39:29.000Z,-0.3612,So the experience pilots who witnessed this in person and radar are just all wrong…? I doubt it.,2025-11-11T16:57:23.000Z,0.0,👍👍👍,2025-11-11T14:00:50.000Z
https://www.tiktok.com/@cbsmornings/video/7548476383270407454,18,-0.0542239999999999,0.3612,Bounce - like a balloon 🎈,2025-09-10T16:48:57.000Z,-0.6808,What threat did the UFO impose? I seen a UFO over Sutro tower in SF 10:23am it was not a blob it was semi transparent with port hole windows .,2025-09-12T15:22:04.000Z,0.0,they will release anything but the Epstein files 🙄,2025-09-10T16:04:46.000Z
https://www.tiktok.com/@uioda0/video/7534702136970546487,25,-0.0637479999999999,0.7263,"I was on the phone with my best friend when this happened. She was screaming something's happening! then she started describing what she saw, the phone dropped. I wasn't able to get a hold of her for 4 hours. then men in suits showed up at her house",2025-08-12T18:50:56.000Z,-0.8581,"That's why we can't meet them yet. Total panic, chaos & fear on our part. I don't think I could remain calm seeing them.",2025-08-07T12:56:45.000Z,0.0,Go to macjohnson76637 page and look at his 17th video. It’s a video of the White House making a speech on the event. And called the unknown species “fitz”,2025-08-12T00:51:18.000Z
https://www.tiktok.com/@martin_espinosa_/video/7566283006290283794,23,-0.068064,0.4588,Me 😈,2025-11-13T12:44:29.000Z,-0.7552,Y’all talking bout aliens when y’all should be talking about Jesus He is coming back the signs are here we just have to see them and take heed to them thrum to Him now before it is too late. Jesus is real and so is hell. Believe me then to Jesus now while there is still time!!✝️,2025-11-07T01:29:03.000Z,0.0,Yall need to chill it’s the casino lights in prior lake,2025-11-07T01:05:16.000Z
https://www.tiktok.com/@ipablosantos/video/7551591657511062815,22,-0.075068,0.4215,lol,2025-09-19T00:35:56.000Z,-0.7783,"Oh hell, no bro I could tell it’s real",2025-09-19T21:57:01.000Z,0.0,Type shi my dad reposts,2025-09-20T00:24:03.000Z
https://www.tiktok.com/@pennypincher1234/video/7541791542202076447,17,-0.0911,0.4939,TR3B USA Space Force ✌,2025-08-23T20:13:08.000Z,-0.7213,DOES NO ONE REALLY NOTICE THIS IS AI 😭🙏,2025-08-24T09:38:55.000Z,0.0,It is TR-3B,2025-08-24T02:52:58.000Z
https://www.tiktok.com/@gygostudio/video/7521475973590584589,20,-0.143284,0.2732,Grown adults btw💔🥀🥀,2025-07-11T23:43:37.000Z,-0.7783,I’d hate to live next door they being to loud for a dam street light😭🙏,2025-07-12T14:52:21.000Z,0.0,How u never seen a dam floodlight before 💀,2025-07-13T03:57:55.000Z
https://www.tiktok.com/@iksovad/video/7535773358936313104,25,-0.227124,0.4404,Yeah everyone has phones yet no caught it on camera 😂,2025-08-11T06:50:28.000Z,-0.8074,"Personally, I don’t think it was some supernatural event, but I also don’t think it was 50-60 kids fighting either. With how people love recording fights, you mean to tell me NO ONE recorded a massive fight involving fireworks and 50-60 people? Come on now.",2025-08-26T15:44:02.000Z,0.0,This story went silent fast!,2025-08-11T17:37:01.000Z
https://www.tiktok.com/@sun_goddess91/video/7513763278867352878,2,-0.2288,0.0,Cloaked space craft.,2025-06-09T06:24:30.000Z,-0.4576,"Another day, another absolutely insane thing that happened",2025-06-09T12:49:44.000Z,0.0,Cloaked space craft.,2025-06-09T06:24:30.000Z
